{"schemaVersion":"dromio.file-upload.v1","id":"upload-1","fileId":"file-1","tenantId":"tenant-1","applicationId":"app-1","status":"pending","expectedSize":4,"expectedChecksum":"sha256:aaaaaaaaaaaaaaaaaaaaaaaaaaaaaaaaaaaaaaaaaaaaaaaaaaaaaaaaaaaaaaaa","parts":[],"createdAt":"2026-01-01T00:00:00Z","expiresAt":"2026-01-02T00:00:00Z","version":1}
